{
  "status": "PASS",
  "failed_checks": [],
  "recommended_action": "pass",
  "notes": [
    "The child remains recognizable and age-appropriate in the approved stylized rendering.",
    "The required scene beat, left text-safe area, center-fold safety, and exact Beki integration are usable."
  ]
}
